{
  "$schema": "https://json-schema.org/draft/2020-12/schema",
  "$id": "https://adili.go.ke/schemas/form-k.v1.json",
  "title": "Form K: Request to access a declaration or clarification (Regs r.22(1))",
  "description": "The prescribed Form K: Part I applicant, Part II the public officer whose declaration is sought, Part III information sought, Part IV declaration of truth; plus the platform's scope fields. Draft: spec 10.",
  "type": "object",
  "required": [
    "schemaVersion",
    "responsibleCommission",
    "partI",
    "partII",
    "partIII",
    "partIV",
    "scope"
  ],
  "additionalProperties": false,
  "properties": {
    "schemaVersion": { "const": "form-k.v1" },
    "responsibleCommission": {
      "type": "string",
      "description": "Tenant key of the Responsible Commission addressed",
      "pattern": "^[a-z][a-z0-9]{1,19}$"
    },
    "partI": {
      "type": "object",
      "description": "Information on applicant",
      "required": [
        "name",
        "identityDocument",
        "postalAddress",
        "physicalAddress",
        "telephone",
        "email",
        "occupation"
      ],
      "additionalProperties": false,
      "properties": {
        "name": {
          "type": "string",
          "minLength": 2,
          "maxLength": 200,
          "description": "Person or entity applying"
        },
        "identityDocument": {
          "type": "object",
          "required": ["kind", "number"],
          "additionalProperties": false,
          "properties": {
            "kind": { "type": "string", "enum": ["national-id", "passport"] },
            "number": { "type": "string", "minLength": 5, "maxLength": 20 },
            "country": {
              "type": "string",
              "pattern": "^[A-Z]{2}$",
              "description": "Issuing country for passports"
            }
          }
        },
        "postalAddress": { "type": "string", "minLength": 3, "maxLength": 200 },
        "physicalAddress": { "type": "string", "minLength": 3, "maxLength": 200 },
        "telephone": { "type": "string", "pattern": "^\\+[1-9][0-9]{6,14}$" },
        "email": { "type": "string", "format": "email" },
        "occupation": { "type": "string", "minLength": 2, "maxLength": 100 }
      }
    },
    "partII": {
      "type": "object",
      "description": "Information on the person whose declaration is sought to be accessed",
      "required": ["name", "entity", "workStation"],
      "additionalProperties": false,
      "properties": {
        "name": { "type": "string", "minLength": 2, "maxLength": 200 },
        "entity": {
          "type": "string",
          "minLength": 2,
          "maxLength": 200,
          "description": "Entity of the public officer"
        },
        "workStation": { "type": "string", "maxLength": 200 },
        "personnelFileNumber": {
          "type": "string",
          "maxLength": 30,
          "description": "Optional, if known"
        }
      }
    },
    "partIII": {
      "type": "object",
      "description": "Information sought",
      "required": ["informationSought", "reason", "otherInformation"],
      "additionalProperties": false,
      "properties": {
        "informationSought": { "type": "string", "minLength": 10, "maxLength": 4000 },
        "reason": {
          "type": "string",
          "minLength": 10,
          "maxLength": 4000,
          "description": "Reason for requiring the information (legitimate interest and good cause, Act s.36(1))"
        },
        "otherInformation": { "type": "string", "maxLength": 4000 }
      }
    },
    "partIV": {
      "type": "object",
      "description": "Declaration",
      "required": ["text", "declaredAt"],
      "additionalProperties": false,
      "properties": {
        "text": {
          "const": "I declare that the information I have given above is true, complete and correct to the best of my knowledge."
        },
        "declaredAt": { "type": "string", "format": "date-time" }
      }
    },
    "scope": {
      "type": "object",
      "description": "Platform scope fields (Admin Mechanism 31 scoped access)",
      "required": [
        "years",
        "includeSpouses",
        "includeChildren",
        "sections",
        "includeClarifications"
      ],
      "additionalProperties": false,
      "properties": {
        "years": {
          "type": "array",
          "minItems": 1,
          "maxItems": 50,
          "uniqueItems": true,
          "items": { "type": "integer", "minimum": 2025 }
        },
        "includeSpouses": { "type": "boolean" },
        "includeChildren": { "type": "boolean" },
        "sections": {
          "type": "array",
          "minItems": 1,
          "uniqueItems": true,
          "items": { "type": "string", "enum": ["bio", "income", "assets", "liabilities", "other"] }
        },
        "includeClarifications": { "type": "boolean" }
      }
    },
    "meta": {
      "type": "object",
      "additionalProperties": false,
      "properties": {
        "reference": { "type": "string" },
        "submittedAt": { "type": "string", "format": "date-time" }
      }
    }
  }
}
