{
  "schemaVersion": "form-k.v1",
  "responsibleCommission": "psc",
  "partI": {
    "name": "Mercy Wanjiku Kamau",
    "identityDocument": { "kind": "national-id", "number": "28475910" },
    "postalAddress": "P.O. Box 30123-00100, Nairobi",
    "physicalAddress": "Kilimani, Argwings Kodhek Road, Nairobi",
    "telephone": "+254712345678",
    "email": "mercy.kamau@example.co.ke",
    "occupation": "Investigative journalist"
  },
  "partII": {
    "name": "Anne Njeri Mutua",
    "entity": "Ministry of Lands and Physical Planning",
    "workStation": "Ardhi House, Nairobi",
    "personnelFileNumber": "PF-2011-004512"
  },
  "partIII": {
    "informationSought": "The officer's declared assets and liabilities for the 2025 and 2026 declaration periods.",
    "reason": "Reporting on land allocations approved by the officer's department, where a conflict of interest has been alleged.",
    "otherInformation": "The story is in the public interest; I am accredited with the Media Council of Kenya."
  },
  "partIV": {
    "text": "I declare that the information I have given above is true, complete and correct to the best of my knowledge.",
    "declaredAt": "2026-09-18T13:02:00+03:00"
  },
  "scope": {
    "years": [2025, 2026],
    "includeSpouses": true,
    "includeChildren": false,
    "sections": ["income", "assets", "liabilities"],
    "includeClarifications": true
  },
  "meta": {
    "reference": "ARQ-PSC-2026-0000001-7",
    "submittedAt": "2026-09-18T13:02:04+03:00"
  }
}
